,box,txt,score
0,"[[660.0, 248.0], [2512.0, 248.0], [2512.0, 368.0], [660.0, 368.0]]",北京大学电子学系前沿学术论坛,0.8893726468086243
1,"[[2179.0, 478.0], [2520.0, 478.0], [2520.0, 625.0], [2179.0, 625.0]]",第5期,0.8651609420776367
2,"[[239.0, 802.0], [2596.0, 802.0], [2596.0, 948.0], [239.0, 948.0]]",单分子电子学的初心和展望,0.9124869704246521
3,"[[979.0, 1271.0], [1626.0, 1271.0], [1626.0, 1395.0], [979.0, 1395.0]]",洪文晶教授,0.9087535738945007
4,"[[983.0, 1501.0], [2303.0, 1501.0], [2303.0, 1563.0], [983.0, 1563.0]]",①时间：2021年5月7日（星期五）14:00-16:00,0.9456477165222168
5,"[[1059.0, 1612.0], [2122.0, 1612.0], [2122.0, 1674.0], [1059.0, 1674.0]]",地点：北京大学理科二号楼2736报告厅,0.9060564637184143
6,"[[975.0, 1719.0], [2268.0, 1719.0], [2268.0, 1781.0], [975.0, 1781.0]]",邀请人：侯士敏教授smhou@pku.edu.cn,0.9379958510398865
7,"[[341.0, 1953.0], [687.0, 1953.0], [687.0, 2033.0], [341.0, 2033.0]]",报告摘要,0.9988069534301758
8,"[[403.0, 2073.0], [1258.0, 2077.0], [1258.0, 2126.0], [403.0, 2121.0]]",With the development and scaling down-,0.9141632914543152
9,"[[337.0, 2130.0], [1262.0, 2130.0], [1262.0, 2175.0], [337.0, 2175.0]]","ward of electronic devices, the dimension of",0.9228095412254333
10,"[[341.0, 2179.0], [1258.0, 2179.0], [1258.0, 2223.0], [341.0, 2223.0]]",electronic device has shrunk down to nanome-,0.9469732642173767
11,"[[341.0, 2228.0], [1262.0, 2228.0], [1262.0, 2272.0], [341.0, 2272.0]]",ter scale. Molecular electronics is an important,0.9694200158119202
12,"[[341.0, 2277.0], [1267.0, 2277.0], [1267.0, 2321.0], [341.0, 2321.0]]","subject of nanoelectronics, which will utilize",0.9567103981971741
13,"[[346.0, 2325.0], [1267.0, 2325.0], [1267.0, 2370.0], [346.0, 2370.0]]",rich varieties of organic and inorganic molecu-,0.9585649371147156
14,"[[341.0, 2374.0], [1267.0, 2374.0], [1267.0, 2418.0], [341.0, 2418.0]]",lar materials as the functioning electronic,0.9059506058692932
15,"[[1431.0, 2401.0], [1564.0, 2401.0], [1564.0, 2432.0], [1431.0, 2432.0]]",BreakJunctio,0.8627029061317444
16,"[[341.0, 2423.0], [1267.0, 2423.0], [1267.0, 2467.0], [341.0, 2467.0]]",component to realize the electronic behaviors,0.93304842710495
17,"[[337.0, 2471.0], [1032.0, 2471.0], [1032.0, 2516.0], [337.0, 2516.0]]",as conventional electronic devices.,0.9381478428840637
18,"[[421.0, 2520.0], [2569.0, 2520.0], [2569.0, 2564.0], [421.0, 2564.0]]","""More Moore"" : The original goal of molecular electronics is to build functional molecules from atomic level,",0.9429075717926025
19,"[[341.0, 2569.0], [2569.0, 2569.0], [2569.0, 2613.0], [341.0, 2613.0]]","and then to build electronic devices and circuits from the individual molecules. Towards this goal, quantum inter-",0.9415490627288818
20,"[[341.0, 2618.0], [2574.0, 2618.0], [2574.0, 2662.0], [341.0, 2662.0]]",ference effect in the charge transport through single-molecule junction enables potential higher switching ratio,0.9535903334617615
21,"[[337.0, 2662.0], [2574.0, 2662.0], [2574.0, 2720.0], [337.0, 2720.0]]",and even lower subthreshold swing than traditional transistors when leads to the single-molecule transistors.,0.9472938776016235
22,"[[341.0, 2720.0], [2565.0, 2720.0], [2565.0, 2764.0], [341.0, 2764.0]]","However, the stability and the integration of multiple devices on chip remained as a major challenge for the fabri",0.9528946876525879
23,"[[337.0, 2768.0], [527.0, 2768.0], [527.0, 2813.0], [337.0, 2813.0]]",cation of,0.9560939073562622
24,"[[536.0, 2768.0], [952.0, 2768.0], [952.0, 2813.0], [536.0, 2813.0]]","“molecular circuits""",0.9333412051200867
25,"[[332.0, 2857.0], [2578.0, 2857.0], [2578.0, 2914.0], [332.0, 2914.0]]","tive analysis of the molecular physical-chemical process by counting the number of molecuies. n this talk, I will",0.9637815356254578
26,"[[341.0, 2914.0], [2569.0, 2914.0], [2569.0, 2959.0], [341.0, 2959.0]]","share our recent effort towards quantitative analysis of the reaction rate, adsorption free energy, isomerization,",0.9412422180175781
27,"[[341.0, 2963.0], [2569.0, 2963.0], [2569.0, 3007.0], [341.0, 3007.0]]","the movement manipulation of molecules, and even the assembly of molecules at the scale of single or several",0.9303414821624756
28,"[[341.0, 3012.0], [558.0, 3012.0], [558.0, 3056.0], [341.0, 3056.0]]",molecules.,0.9631787538528442
29,"[[412.0, 3061.0], [2578.0, 3061.0], [2578.0, 3105.0], [412.0, 3105.0]]","As perspective, recent advances of molecular electronics will lead to their device application on the field of",0.9133691787719727
30,"[[332.0, 3105.0], [1475.0, 3105.0], [1475.0, 3149.0], [332.0, 3149.0]]", sensors and thermoelectric devices in the next ten years.,0.9636393189430237
31,"[[346.0, 3198.0], [731.0, 3198.0], [731.0, 3291.0], [346.0, 3291.0]]",报告人简介,0.9908205270767212
32,"[[350.0, 3357.0], [2574.0, 3357.0], [2574.0, 3415.0], [350.0, 3415.0]]",洪文晶，厦门大学化学化工学院/人工智能研究院教授、化学化工学院副院长，国家高层次青年人才,0.9522689580917358
33,"[[350.0, 3415.0], [2574.0, 3415.0], [2574.0, 3472.0], [350.0, 3472.0]]",项目、基金委优秀青年科学基金入选者，兼任嘉庚创新实验室主任助理。主要从事面向战略新兴产,0.9389914870262146
34,"[[346.0, 3468.0], [2578.0, 3473.0], [2578.0, 3530.0], [345.0, 3526.0]]",业的碳基电子器件研究和工业智能研发，开展化学工程与智能科学、新材料、电子器件等领域相融,0.9225730895996094
35,"[[350.0, 3530.0], [2578.0, 3530.0], [2578.0, 3588.0], [350.0, 3588.0]]",合的前沿交叉研究。作为通讯或共同通讯作者发表论文68篇，包括Nat.Mater.、Sci.Adv.和科学通,0.953415036201477
36,"[[350.0, 3583.0], [2574.0, 3583.0], [2574.0, 3641.0], [350.0, 3641.0]]",报等国内外重要期刊论文，作为独立通讯作者受邀在Acc．Chem．Res，Chem。Soc．Rev.和Adv.,0.887069582939148
37,"[[350.0, 3641.0], [2569.0, 3641.0], [2569.0, 3698.0], [350.0, 3698.0]]",Mater.等发表综述，论文总他引五千余次，出版专著1部，授权发明专利6项，开发的精密科学仪器,0.9671416878700256
38,"[[350.0, 3698.0], [2578.0, 3698.0], [2578.0, 3756.0], [350.0, 3756.0]]",进入国内外十余个顶尖科研单位。主持建设亚洲首座、各项指标达到国际领先水平、面向半导体和,0.942836344242096
39,"[[350.0, 3756.0], [2578.0, 3756.0], [2578.0, 3814.0], [350.0, 3814.0]]",新材料产业的无噪声精密加工和表征实验室，牵头建设了“智能过程监测、控制与优化”创新团队,0.9278518557548523
40,"[[350.0, 3818.0], [1161.0, 3818.0], [1161.0, 3862.0], [350.0, 3862.0]]",和5个千万级和百万级校企研发中心。,0.9728854894638062
41,"[[354.0, 3915.0], [1887.0, 3915.0], [1887.0, 4022.0], [354.0, 4022.0]]",欢迎各位老师、同学参加！,0.9053966403007507
42,"[[1001.0, 4101.0], [2215.0, 4101.0], [2215.0, 4159.0], [1001.0, 4159.0]]",关注电子学系微信公众号，了解更多讲座信息！,0.9032877087593079
